{
  "v": 1,
  "jobId": "cm2summarize00000000001",
  "type": "reader.summarize",
  "toolId": "reader",
  "userId": "cm2user000000000000001",
  "attempt": 2,
  "correlationId": null,
  "publishedAt": "2026-10-25T10:01:35.000Z",
  "payload": {
    "bookId": "4b3c5f1e-0c4e-4d8a-9c1a-0f6b5e3a2d11",
    "summaryId": "cm2summary000000000001",
    "extractionStorageKey": "extraction/4b3c5f1e-0c4e-4d8a-9c1a-0f6b5e3a2d11_extraction.md",
    "summaryType": "abstractive",
    "strategy": "two_pass",
    "summaryPercent": 0.4,
    "title": "A Book"
  }
}
